"location","source","target","ID","fuzzy","context","translator_comments","developer_comments"
"src-en/data/text_tooltips.xml.append:2","data/text_tooltips.xml.append$/FTL/text[@name=""tooltip_crew_page_down""]","Click to go down one page of crew. \nYou can also use the scroll wheel.","data/text_tooltips.xml.append$/FTL/text[@name=""tooltip_crew_page_down""]","","","",""
"src-en/data/text_tooltips.xml.append:3","data/text_tooltips.xml.append$/FTL/text[@name=""tooltip_crew_page_up""]","Click to go down up page of crew. \nYou can also use the scroll wheel.","data/text_tooltips.xml.append$/FTL/text[@name=""tooltip_crew_page_up""]","","","",""
"src-en/data/text_tooltips.xml.append:5","data/text_tooltips.xml.append$/FTL/text[@name=""tooltip_jump_noJump""]","The enemy ship has disabled your FTL drive. There is no escape; you must defeat the enemy ship if you want to survive!","data/text_tooltips.xml.append$/FTL/text[@name=""tooltip_jump_noJump""]","","","",""
"src-en/data/text_tooltips.xml.append:7","data/text_tooltips.xml.append$/FTL/text[@name=""tooltip_temporal""]","Temporal Manipulator: Changes the rate of time in one room.","data/text_tooltips.xml.append$/FTL/text[@name=""tooltip_temporal""]","","","",""
"src-en/data/text_tooltips.xml.append:8","data/text_tooltips.xml.append$/FTL/text[@name=""tooltip_temporal_enemy""]","Temporal Manipulator: The enemy can use this to change the rate of time in one room.","data/text_tooltips.xml.append$/FTL/text[@name=""tooltip_temporal_enemy""]","","","",""
