"location","source","target","ID","fuzzy","context","translator_comments","developer_comments"
"src-en/data/newEvents.xml.append:1787","data/newEvents.xml.append$/FTL/eventList[@name=""EMPTY_STATION2_CLONE""]/event[2]/text","The clone is extremely confused but seems to accept their new situation. With no other options the clone offers to work on your ship for a time.","data/newEvents.xml.append$/FTL/eventList[@name=""EMPTY_STATION2_CLONE""]/event[2]/text","","","",""
"src-en/data/newEvents.xml.append:1791","data/newEvents.xml.append$/FTL/eventList[@name=""EMPTY_STATION2_CLONE""]/event[3]/text","The clone emerges in a crazed frenzy and refuses to calm down. You have no choice but to fight.","data/newEvents.xml.append$/FTL/eventList[@name=""EMPTY_STATION2_CLONE""]/event[3]/text","","","",""
"src-en/data/newEvents.xml.append:1797","data/newEvents.xml.append$/FTL/textList[@name=""REBEL_CHECKPOINT_TEXT""]/text[1]","It looks like this Beacon is home to a Rebel checkpoint. They're stopping and searching any ship that passes through. Civilians are being harassed, and Federation members are detained. The Rebels haven't noticed you yet.","data/newEvents.xml.append$/FTL/textList[@name=""REBEL_CHECKPOINT_TEXT""]/text[1]","","","",""
"src-en/data/newEvents.xml.append:1798","data/newEvents.xml.append$/FTL/textList[@name=""REBEL_CHECKPOINT_TEXT""]/text[2]","Another Rebel checkpoint is monitoring this location. A number of civilian ships are awaiting inspection, any of them could be Federation loyalists. The Rebels haven't noticed you yet.","data/newEvents.xml.append$/FTL/textList[@name=""REBEL_CHECKPOINT_TEXT""]/text[2]","","","",""
"src-en/data/newEvents.xml.append:1799","data/newEvents.xml.append$/FTL/textList[@name=""REBEL_CHECKPOINT_TEXT""]/text[3]","A Rebel space station and single fighter is monitoring this Beacon for Federation activity. A number of civilian ships are docked, awaiting inspection by the Rebels and possible detainment if they are Federation loyalists. The Rebels haven't noticed you yet.","data/newEvents.xml.append$/FTL/textList[@name=""REBEL_CHECKPOINT_TEXT""]/text[3]","","","",""
"src-en/data/newEvents.xml.append:1800","data/newEvents.xml.append$/FTL/textList[@name=""REBEL_CHECKPOINT_TEXT""]/text[4]","A rather large fleet of civilian ships are held up at this Beacon. It appears to be a Rebel checkpoint; everyone is being inspected for possible ties to the Federation. No one has noticed you yet.","data/newEvents.xml.append$/FTL/textList[@name=""REBEL_CHECKPOINT_TEXT""]/text[4]","","","",""
"src-en/data/newEvents.xml.append:1803","data/newEvents.xml.append$/FTL/textList[@name=""REBEL_BRIBE_TEXT""]/text[1]","These Rebels are easily swayed by the prospect of additional scrap. They release the civilian ships and everyone is free to go.","data/newEvents.xml.append$/FTL/textList[@name=""REBEL_BRIBE_TEXT""]/text[1]","","","",""
"src-en/data/newEvents.xml.append:1804","data/newEvents.xml.append$/FTL/textList[@name=""REBEL_BRIBE_TEXT""]/text[2]","Like most Rebels, these are just men trying to get by in a rough galaxy. They take your scrap and let everyone continue their journeys.","data/newEvents.xml.append$/FTL/textList[@name=""REBEL_BRIBE_TEXT""]/text[2]","","","",""
"src-en/data/newEvents.xml.append:1805","data/newEvents.xml.append$/FTL/textList[@name=""REBEL_BRIBE_TEXT""]/text[3]","As everyone currently awaiting inspection is human anyway, the Rebels let them go. They take your scrap and tell you to hurry along.","data/newEvents.xml.append$/FTL/textList[@name=""REBEL_BRIBE_TEXT""]/text[3]","","","",""
"src-en/data/newEvents.xml.append:1806","data/newEvents.xml.append$/FTL/textList[@name=""REBEL_BRIBE_TEXT""]/text[4]","They eagerly accept your bribe, obviously revolutionaries are under paid. The civilian ships all begin to jump away.","data/newEvents.xml.append$/FTL/textList[@name=""REBEL_BRIBE_TEXT""]/text[4]","","","",""
"src-en/data/newEvents.xml.append:1809","data/newEvents.xml.append$/FTL/textList[@name=""GENERIC_HIDE_TEXT""]/text[1]","Fly behind a moon and stay hidden.","data/newEvents.xml.append$/FTL/textList[@name=""GENERIC_HIDE_TEXT""]/text[1]","","","",""
"src-en/data/newEvents.xml.append:1810","data/newEvents.xml.append$/FTL/textList[@name=""GENERIC_HIDE_TEXT""]/text[2]","Shut down all non-vital systems and stay hidden.","data/newEvents.xml.append$/FTL/textList[@name=""GENERIC_HIDE_TEXT""]/text[2]","","","",""
"src-en/data/newEvents.xml.append:1811","data/newEvents.xml.append$/FTL/textList[@name=""GENERIC_HIDE_TEXT""]/text[3]","Stay quiet and hope they don't notice you.","data/newEvents.xml.append$/FTL/textList[@name=""GENERIC_HIDE_TEXT""]/text[3]","","","",""
"src-en/data/newEvents.xml.append:1812","data/newEvents.xml.append$/FTL/textList[@name=""GENERIC_HIDE_TEXT""]/text[4]","Stay out of their way and charge your FTL drive.","data/newEvents.xml.append$/FTL/textList[@name=""GENERIC_HIDE_TEXT""]/text[4]","","","",""
"src-en/data/newEvents.xml.append:1815","data/newEvents.xml.append$/FTL/event[@name=""REBEL_CHECKPOINT""]/text","","data/newEvents.xml.append$/FTL/event[@name=""REBEL_CHECKPOINT""]/text","","","",""
"src-en/data/newEvents.xml.append:1818","data/newEvents.xml.append$/FTL/event[@name=""REBEL_CHECKPOINT""]/choice[1]/text","Fend for yourself, attack and escape.","data/newEvents.xml.append$/FTL/event[@name=""REBEL_CHECKPOINT""]/choice[1]/text","","","",""
"src-en/data/newEvents.xml.append:1820","data/newEvents.xml.append$/FTL/event[@name=""REBEL_CHECKPOINT""]/choice[1]/event/text","You move in to attack the Rebel ship.","data/newEvents.xml.append$/FTL/event[@name=""REBEL_CHECKPOINT""]/choice[1]/event/text","","","",""
"src-en/data/newEvents.xml.append:1823","data/newEvents.xml.append$/FTL/event[@name=""REBEL_CHECKPOINT""]/choice[1]/event/choice/text","Continue...","data/newEvents.xml.append$/FTL/event[@name=""REBEL_CHECKPOINT""]/choice[1]/event/choice/text","","","",""
"src-en/data/newEvents.xml.append:1829","data/newEvents.xml.append$/FTL/event[@name=""REBEL_CHECKPOINT""]/choice[2]/text","Bribe the Rebels to release the civilian ships.","data/newEvents.xml.append$/FTL/event[@name=""REBEL_CHECKPOINT""]/choice[2]/text","","","",""
"src-en/data/newEvents.xml.append:1831","data/newEvents.xml.append$/FTL/event[@name=""REBEL_CHECKPOINT""]/choice[2]/event/text","","data/newEvents.xml.append$/FTL/event[@name=""REBEL_CHECKPOINT""]/choice[2]/event/text","","","",""
"src-en/data/newEvents.xml.append:1836","data/newEvents.xml.append$/FTL/event[@name=""REBEL_CHECKPOINT""]/choice[2]/event/choice/text","Contact the civilian ships.","data/newEvents.xml.append$/FTL/event[@name=""REBEL_CHECKPOINT""]/choice[2]/event/choice/text","","","",""
"src-en/data/newEvents.xml.append:1842","data/newEvents.xml.append$/FTL/event[@name=""REBEL_CHECKPOINT""]/choice[3]/text","(Forged ID) Pretend to be a Rebel ship.","data/newEvents.xml.append$/FTL/event[@name=""REBEL_CHECKPOINT""]/choice[3]/text","","","",""
"src-en/data/newEvents.xml.append:1844","data/newEvents.xml.append$/FTL/event[@name=""REBEL_CHECKPOINT""]/choice[3]/event/text","Rebel forces are bloated with washups, conscripts, or disheartened officers who are only in its ranks because their reality was conquered by Rebels first. The Rebel running the checkpoint barely even glances at your ID before deciding to let you past.","data/newEvents.xml.append$/FTL/event[@name=""REBEL_CHECKPOINT""]/choice[3]/event/text","","","",""
"src-en/data/newEvents.xml.append:1846","data/newEvents.xml.append$/FTL/event[@name=""REBEL_CHECKPOINT""]/choice[3]/event/choice[1]/text","Take a chance and request they free some civilians.","data/newEvents.xml.append$/FTL/event[@name=""REBEL_CHECKPOINT""]/choice[3]/event/choice[1]/text","","","",""
"src-en/data/newEvents.xml.append:1848","data/newEvents.xml.append$/FTL/event[@name=""REBEL_CHECKPOINT""]/choice[3]/event/choice[1]/event/text","At first the Rebels don't buy it, but you manage to pull some trickery to convince them that several of the civilians were cleared for release. The officer in charge is satisfied with this at first while you start taking civilians on-board, but eventually grows impatient and decides he's had enough of your ruse.","data/newEvents.xml.append$/FTL/event[@name=""REBEL_CHECKPOINT""]/choice[3]/event/choice[1]/event/text","","","",""
"src-en/data/newEvents.xml.append:1852","data/newEvents.xml.append$/FTL/event[@name=""REBEL_CHECKPOINT""]/choice[3]/event/choice[1]/event/choice/text","Continue...","data/newEvents.xml.append$/FTL/event[@name=""REBEL_CHECKPOINT""]/choice[3]/event/choice[1]/event/choice/text","","","",""
"src-en/data/newEvents.xml.append:1858","data/newEvents.xml.append$/FTL/event[@name=""REBEL_CHECKPOINT""]/choice[3]/event/choice[2]/text","Take this chance to do something aboard the ship.","data/newEvents.xml.append$/FTL/event[@name=""REBEL_CHECKPOINT""]/choice[3]/event/choice[2]/text","","","",""
"src-en/data/newEvents.xml.append:1864","data/newEvents.xml.append$/FTL/event[@name=""REBEL_CHECKPOINT""]/choice[4]/text","(Engineer Crew) Pretend to be a Rebel ship.","data/newEvents.xml.append$/FTL/event[@name=""REBEL_CHECKPOINT""]/choice[4]/text","","","",""
"src-en/data/newEvents.xml.append:1866","data/newEvents.xml.append$/FTL/event[@name=""REBEL_CHECKPOINT""]/choice[4]/event/text","Rebel forces are bloated with washups, conscripts, or disheartened officers who are only in its ranks because their reality was conquered by Rebels first. The Rebel running the checkpoint barely even glances at your Engineer's outdated Rebel ID before deciding to let you past.","data/newEvents.xml.append$/FTL/event[@name=""REBEL_CHECKPOINT""]/choice[4]/event/text","","","",""
"src-en/data/newEvents.xml.append:1868","data/newEvents.xml.append$/FTL/event[@name=""REBEL_CHECKPOINT""]/choice[4]/event/choice[1]/text","Take a chance and request they free some civilians.","data/newEvents.xml.append$/FTL/event[@name=""REBEL_CHECKPOINT""]/choice[4]/event/choice[1]/text","","","",""
"src-en/data/newEvents.xml.append:1870","data/newEvents.xml.append$/FTL/event[@name=""REBEL_CHECKPOINT""]/choice[4]/event/choice[1]/event/text","At first the Rebels don't buy it, but you manage to pull some trickery to convince them that several of the civilians were cleared for release. The officer in charge is satisfied with this at first while you start taking civilians on-board, but eventually grows impatient and decides he's had enough of your ruse.","data/newEvents.xml.append$/FTL/event[@name=""REBEL_CHECKPOINT""]/choice[4]/event/choice[1]/event/text","","","",""
"src-en/data/newEvents.xml.append:1874","data/newEvents.xml.append$/FTL/event[@name=""REBEL_CHECKPOINT""]/choice[4]/event/choice[1]/event/choice/text","Continue...","data/newEvents.xml.append$/FTL/event[@name=""REBEL_CHECKPOINT""]/choice[4]/event/choice[1]/event/choice/text","","","",""
"src-en/data/newEvents.xml.append:1880","data/newEvents.xml.append$/FTL/event[@name=""REBEL_CHECKPOINT""]/choice[4]/event/choice[2]/text","Take this chance to do something aboard the ship.","data/newEvents.xml.append$/FTL/event[@name=""REBEL_CHECKPOINT""]/choice[4]/event/choice[2]/text","","","",""
"src-en/data/newEvents.xml.append:1888","data/newEvents.xml.append$/FTL/eventList[@name=""REBEL_BRIBE_RESULT""]/event[1]/text","The civilians are grateful. However, none of them seem eager to be mistaken as Federation loyalists so they quickly jump away.","data/newEvents.xml.append$/FTL/eventList[@name=""REBEL_BRIBE_RESULT""]/event[1]/text","","","",""
"src-en/data/newEvents.xml.append:1891","data/newEvents.xml.append$/FTL/eventList[@name=""REBEL_BRIBE_RESULT""]/event[2]/text","Some of the civilians pool together their excess scrap to try to repay you for your help.","data/newEvents.xml.append$/FTL/eventList[@name=""REBEL_BRIBE_RESULT""]/event[2]/text","","","",""
"src-en/data/newEvents.xml.append:1895","data/newEvents.xml.append$/FTL/eventList[@name=""REBEL_BRIBE_RESULT""]/event[3]/text","One of the civilian ships quietly teleports over a crate of Federation military supplies.","data/newEvents.xml.append$/FTL/eventList[@name=""REBEL_BRIBE_RESULT""]/event[3]/text","","","",""
"src-en/data/newEvents.xml.append:1899","data/newEvents.xml.append$/FTL/eventList[@name=""REBEL_BRIBE_RESULT""]/event[4]/text","One of the civilian ships contacts you and reveals they are Federation loyalists. An eavesdropping Rebel swoops in, destroys the ship, and turns to attack you!","data/newEvents.xml.append$/FTL/eventList[@name=""REBEL_BRIBE_RESULT""]/event[4]/text","","","",""
"src-en/data/newEvents.xml.append:1902","data/newEvents.xml.append$/FTL/eventList[@name=""REBEL_BRIBE_RESULT""]/event[4]/choice/text","Continue...","data/newEvents.xml.append$/FTL/eventList[@name=""REBEL_BRIBE_RESULT""]/event[4]/choice/text","","","",""
"src-en/data/newEvents.xml.append:1909","data/newEvents.xml.append$/FTL/textList[@name=""REBEL_HELPERS_TEXT""]/text[1]","You stumble across a Rebel ship distributing supplies to local civilian colonies. It's probably not anything military grade, but every little bit helps...","data/newEvents.xml.append$/FTL/textList[@name=""REBEL_HELPERS_TEXT""]/text[1]","","","",""
"src-en/data/newEvents.xml.append:1910","data/newEvents.xml.append$/FTL/textList[@name=""REBEL_HELPERS_TEXT""]/text[2]","You find a Rebel combat ship that has been reassigned as an emergency supply vessel. The local civilians are apparently in need of help, and the Rebels are rising to the occasion.","data/newEvents.xml.append$/FTL/textList[@name=""REBEL_HELPERS_TEXT""]/text[2]","","","",""
"src-en/data/newEvents.xml.append:1911","data/newEvents.xml.append$/FTL/textList[@name=""REBEL_HELPERS_TEXT""]/text[3]","The Rebels in this system are doing supply runs for the local space stations. These civilians have likely been out of supply for months due to the war and are in desperate need.","data/newEvents.xml.append$/FTL/textList[@name=""REBEL_HELPERS_TEXT""]/text[3]","","","",""
"src-en/data/newEvents.xml.append:1912","data/newEvents.xml.append$/FTL/textList[@name=""REBEL_HELPERS_TEXT""]/text[4]","Civilian colonists loyal to the Rebel cause are present on a nearby planet. It looks like they are currently receiving a supply shipment. Could be useful.","data/newEvents.xml.append$/FTL/textList[@name=""REBEL_HELPERS_TEXT""]/text[4]","","","",""
"src-en/data/newEvents.xml.append:1913","data/newEvents.xml.append$/FTL/textList[@name=""REBEL_HELPERS_TEXT""]/text[5]","Because of the war, thousands of colonists have had their supply lines disrupted and have found themselves in dire straits. It seems in this system, the Rebels are sympathetic and are distributing what little supplies they can spare.","data/newEvents.xml.append$/FTL/textList[@name=""REBEL_HELPERS_TEXT""]/text[5]","","","",""
"src-en/data/newEvents.xml.append:1916","data/newEvents.xml.append$/FTL/event[@name=""REBEL_HELPER_NO_SUPPLIES""]/text","","data/newEvents.xml.append$/FTL/event[@name=""REBEL_HELPER_NO_SUPPLIES""]/text","","","",""
"src-en/data/newEvents.xml.append:1919","data/newEvents.xml.append$/FTL/textList[@name=""REBEL_HELPER_NO_SUPPLIES_TEXT""]/text[1]","You make to preparations to leave. One of the civilian leaders contacts you: ""That Rebel was our sole source of supplies. You have doomed us all.""","data/newEvents.xml.append$/FTL/textList[@name=""REBEL_HELPER_NO_SUPPLIES_TEXT""]/text[1]","","","",""
"src-en/data/newEvents.xml.append:1920","data/newEvents.xml.append$/FTL/textList[@name=""REBEL_HELPER_NO_SUPPLIES_TEXT""]/text[2]","You leave the civilians with the supplies, though without the Rebel that was running supplies to them its unlikely they'll live long.","data/newEvents.xml.append$/FTL/textList[@name=""REBEL_HELPER_NO_SUPPLIES_TEXT""]/text[2]","","","",""
"src-en/data/newEvents.xml.append:1921","data/newEvents.xml.append$/FTL/textList[@name=""REBEL_HELPER_NO_SUPPLIES_TEXT""]/text[3]","You wonder if any more Rebels will be available to help these civilians on the edge of nowhere. Oh well, for you a few more dead Rebels matter more than the lives of a thousand colonists.","data/newEvents.xml.append$/FTL/textList[@name=""REBEL_HELPER_NO_SUPPLIES_TEXT""]/text[3]","","","",""
"src-en/data/newEvents.xml.append:1922","data/newEvents.xml.append$/FTL/textList[@name=""REBEL_HELPER_NO_SUPPLIES_TEXT""]/text[4]","Before your FTL drive charges, you receive a hail: ""My son was on that ship. He only helped the Rebels because they cared enough to help us. Without him to find us supplies, we'll likely be forgotten and die out here.""","data/newEvents.xml.append$/FTL/textList[@name=""REBEL_HELPER_NO_SUPPLIES_TEXT""]/text[4]","","","",""
"src-en/data/newEvents.xml.append:1925","data/newEvents.xml.append$/FTL/event[@name=""REBEL_HELPERS""]/text","","data/newEvents.xml.append$/FTL/event[@name=""REBEL_HELPERS""]/text","","","",""
"src-en/data/newEvents.xml.append:1928","data/newEvents.xml.append$/FTL/event[@name=""REBEL_HELPERS""]/choice[1]/text","Attack the Rebels.","data/newEvents.xml.append$/FTL/event[@name=""REBEL_HELPERS""]/choice[1]/text","","","",""
"src-en/data/newEvents.xml.append:1930","data/newEvents.xml.append$/FTL/event[@name=""REBEL_HELPERS""]/choice[1]/event/text","You engage the Rebel ship.","data/newEvents.xml.append$/FTL/event[@name=""REBEL_HELPERS""]/choice[1]/event/text","","","",""
"src-en/data/newEvents.xml.append:1933","data/newEvents.xml.append$/FTL/event[@name=""REBEL_HELPERS""]/choice[1]/event/choice/text","Continue...","data/newEvents.xml.append$/FTL/event[@name=""REBEL_HELPERS""]/choice[1]/event/choice/text","","","",""
"src-en/data/newEvents.xml.append:1939","data/newEvents.xml.append$/FTL/event[@name=""REBEL_HELPERS""]/choice[2]/text","(Forged ID) Pretend to be a Rebel ship and deliver the supplies yourself.","data/newEvents.xml.append$/FTL/event[@name=""REBEL_HELPERS""]/choice[2]/text","","","",""
"src-en/data/newEvents.xml.append:1941","data/newEvents.xml.append$/FTL/event[@name=""REBEL_HELPERS""]/choice[2]/event/text","""Oh, are you the one command sent to start making these deliveries? Great, take these and bring them down there to those colonists. They'll be waiting for you.""","data/newEvents.xml.append$/FTL/event[@name=""REBEL_HELPERS""]/choice[2]/event/text","","","",""
"src-en/data/newEvents.xml.append:1943","data/newEvents.xml.append$/FTL/event[@name=""REBEL_HELPERS""]/choice[2]/event/choice[1]/text","Deliver the supplies.","data/newEvents.xml.append$/FTL/event[@name=""REBEL_HELPERS""]/choice[2]/event/choice[1]/text","","","",""
"src-en/data/newEvents.xml.append:1945","data/newEvents.xml.append$/FTL/event[@name=""REBEL_HELPERS""]/choice[2]/event/choice[1]/event/text","You fly down to the planet surface where you drop off the supplies. The colonists are confused as they don't recognize you, but they're glad for the help and offer some repairs and some work on your weapons system.","data/newEvents.xml.append$/FTL/event[@name=""REBEL_HELPERS""]/choice[2]/event/choice[1]/event/text","","","",""
"src-en/data/newEvents.xml.append:1951","data/newEvents.xml.append$/FTL/event[@name=""REBEL_HELPERS""]/choice[2]/event/choice[2]/text","Steal the supplies.","data/newEvents.xml.append$/FTL/event[@name=""REBEL_HELPERS""]/choice[2]/event/choice[2]/text","","","",""
"src-en/data/newEvents.xml.append:1957","data/newEvents.xml.append$/FTL/event[@name=""REBEL_HELPERS""]/choice[3]/text","Wait and steal the supplies from the civilians.","data/newEvents.xml.append$/FTL/event[@name=""REBEL_HELPERS""]/choice[3]/text","","","",""
"src-en/data/newEvents.xml.append:1961","data/newEvents.xml.append$/FTL/event[@name=""REBEL_HELPERS""]/choice[4]/text","Leave them be.","data/newEvents.xml.append$/FTL/event[@name=""REBEL_HELPERS""]/choice[4]/text","","","",""
"src-en/data/newEvents.xml.append:1963","data/newEvents.xml.append$/FTL/event[@name=""REBEL_HELPERS""]/choice[4]/event/text","You decide not to bother the Rebels.","data/newEvents.xml.append$/FTL/event[@name=""REBEL_HELPERS""]/choice[4]/event/text","","","",""
"src-en/data/newEvents.xml.append:1965","data/newEvents.xml.append$/FTL/event[@name=""REBEL_HELPERS""]/choice[4]/event/choice[1]/text","Do something onboard the ship.","data/newEvents.xml.append$/FTL/event[@name=""REBEL_HELPERS""]/choice[4]/event/choice[1]/text","","","",""
"src-en/data/newEvents.xml.append:1969","data/newEvents.xml.append$/FTL/event[@name=""REBEL_HELPERS""]/choice[4]/event/choice[2]/text","Do nothing.","data/newEvents.xml.append$/FTL/event[@name=""REBEL_HELPERS""]/choice[4]/event/choice[2]/text","","","",""
"src-en/data/newEvents.xml.append:1977","data/newEvents.xml.append$/FTL/eventList[@name=""REBEL_HELPERS_SUPPLIES""]/event[1]/text","The colonists hand over the supplies. It appears to be mostly equipment meant for automated farming, but you can make use of it. As you leave, you receive a message: ""This is why the Rebels will always have support!""","data/newEvents.xml.append$/FTL/eventList[@name=""REBEL_HELPERS_SUPPLIES""]/event[1]/text","","","",""
"src-en/data/newEvents.xml.append:1980","data/newEvents.xml.append$/FTL/eventList[@name=""REBEL_HELPERS_SUPPLIES""]/event[1]/choice/text","Continue...","data/newEvents.xml.append$/FTL/eventList[@name=""REBEL_HELPERS_SUPPLIES""]/event[1]/choice/text","","","",""
"src-en/data/newEvents.xml.append:1985","data/newEvents.xml.append$/FTL/eventList[@name=""REBEL_HELPERS_SUPPLIES""]/event[2]/text","The colonists hand over the supplies and you load it onto your ship. As you jump away, you crack it open and discover nothing more than vaccinations for a local plague.","data/newEvents.xml.append$/FTL/eventList[@name=""REBEL_HELPERS_SUPPLIES""]/event[2]/text","","","",""
"src-en/data/newEvents.xml.append:1987","data/newEvents.xml.append$/FTL/eventList[@name=""REBEL_HELPERS_SUPPLIES""]/event[2]/choice/text","Continue...","data/newEvents.xml.append$/FTL/eventList[@name=""REBEL_HELPERS_SUPPLIES""]/event[2]/choice/text","","","",""
"src-en/data/newEvents.xml.append:1992","data/newEvents.xml.append$/FTL/eventList[@name=""REBEL_HELPERS_SUPPLIES""]/event[3]/text","You make the colonists teleport the supplies to your ship. It's nothing more than building construction supplies. Oh well, scrap is scrap.","data/newEvents.xml.append$/FTL/eventList[@name=""REBEL_HELPERS_SUPPLIES""]/event[3]/text","","","",""
"src-en/data/newEvents.xml.append:1995","data/newEvents.xml.append$/FTL/eventList[@name=""REBEL_HELPERS_SUPPLIES""]/event[3]/choice/text","Continue...","data/newEvents.xml.append$/FTL/eventList[@name=""REBEL_HELPERS_SUPPLIES""]/event[3]/choice/text","","","",""
"src-en/data/newEvents.xml.append:2000","data/newEvents.xml.append$/FTL/eventList[@name=""REBEL_HELPERS_SUPPLIES""]/event[4]/text","The colonists willingly give up their supplies. But as you make to jump away, an explosion rocks your ship. The cargo was booby trapped!","data/newEvents.xml.append$/FTL/eventList[@name=""REBEL_HELPERS_SUPPLIES""]/event[4]/text","","","",""
"src-en/data/newEvents.xml.append:2003","data/newEvents.xml.append$/FTL/eventList[@name=""REBEL_HELPERS_SUPPLIES""]/event[4]/choice/text","Continue...","data/newEvents.xml.append$/FTL/eventList[@name=""REBEL_HELPERS_SUPPLIES""]/event[4]/choice/text","","","",""
"src-en/data/newEvents.xml.append:2009","data/newEvents.xml.append$/FTL/eventList[@name=""REBEL_HELPERS_SUPPLIES""]/event[5]/text","The colonists hand over the supplies. It appears to be nothing more than some basic medical supplies.","data/newEvents.xml.append$/FTL/eventList[@name=""REBEL_HELPERS_SUPPLIES""]/event[5]/text","","","",""
"src-en/data/newEvents.xml.append:2012","data/newEvents.xml.append$/FTL/eventList[@name=""REBEL_HELPERS_SUPPLIES""]/event[5]/choice/text","Continue...","data/newEvents.xml.append$/FTL/eventList[@name=""REBEL_HELPERS_SUPPLIES""]/event[5]/choice/text","","","",""
"src-en/data/newEvents.xml.append:2017","data/newEvents.xml.append$/FTL/eventList[@name=""REBEL_HELPERS_SUPPLIES""]/event[6]/text","The colonists hand over the supplies. It appears to be a small supply of ammunition, probably for their mining operations.","data/newEvents.xml.append$/FTL/eventList[@name=""REBEL_HELPERS_SUPPLIES""]/event[6]/text","","","",""
"src-en/data/newEvents.xml.append:2020","data/newEvents.xml.append$/FTL/eventList[@name=""REBEL_HELPERS_SUPPLIES""]/event[6]/choice/text","Continue...","data/newEvents.xml.append$/FTL/eventList[@name=""REBEL_HELPERS_SUPPLIES""]/event[6]/choice/text","","","",""
"src-en/data/newEvents.xml.append:2025","data/newEvents.xml.append$/FTL/eventList[@name=""REBEL_HELPERS_SUPPLIES""]/event[7]/text","The colonists aren't willing to give up the supplies without a fight. As you bring the cargo back to your ship, a horde of angry civilians board and try to take it back!","data/newEvents.xml.append$/FTL/eventList[@name=""REBEL_HELPERS_SUPPLIES""]/event[7]/text","","","",""
"src-en/data/newEvents.xml.append:2029","data/newEvents.xml.append$/FTL/eventList[@name=""REBEL_HELPERS_SUPPLIES""]/event[7]/choice/text","Continue...","data/newEvents.xml.append$/FTL/eventList[@name=""REBEL_HELPERS_SUPPLIES""]/event[7]/choice/text","","","",""
"src-en/data/newEvents.xml.append:2036","data/newEvents.xml.append$/FTL/eventList[@name=""REBEL_HELPERS_STEAL""]/event[1]/text","It appears the supplies are mostly equipment meant for automated farming, but you can make use of it. As you leave, you receive a message: ""This is why the Rebels will always have support!""","data/newEvents.xml.append$/FTL/eventList[@name=""REBEL_HELPERS_STEAL""]/event[1]/text","","","",""
"src-en/data/newEvents.xml.append:2041","data/newEvents.xml.append$/FTL/eventList[@name=""REBEL_HELPERS_STEAL""]/event[2]/text","The supplies are nothing more than building construction supplies. Oh well, scrap is scrap.","data/newEvents.xml.append$/FTL/eventList[@name=""REBEL_HELPERS_STEAL""]/event[2]/text","","","",""
