"location","source","target","ID","fuzzy","context","translator_comments","developer_comments"
"src-en/data/events_mantis.xml.append:1353","data/events_mantis.xml.append$/FTL/event[@name=""QUEST_HIVE_FREEMANTIS_HUNTER""]/choice[1]/text","Attempt to communicate.","data/events_mantis.xml.append$/FTL/event[@name=""QUEST_HIVE_FREEMANTIS_HUNTER""]/choice[1]/text","","","",""
"src-en/data/events_mantis.xml.append:1355","data/events_mantis.xml.append$/FTL/event[@name=""QUEST_HIVE_FREEMANTIS_HUNTER""]/choice[1]/event/text","The Free Mantis is ecstatic to see you. ""Perfect day, how glad we are to meet you here, Captain! We have important information to tell you. Here are co-ordinates of Mantis camp we find. Do with what you want, we must leave soon and return to clan. Best of luck.""","data/events_mantis.xml.append$/FTL/event[@name=""QUEST_HIVE_FREEMANTIS_HUNTER""]/choice[1]/event/text","","","",""
"src-en/data/events_mantis.xml.append:1360","data/events_mantis.xml.append$/FTL/event[@name=""QUEST_HIVE_FREEMANTIS_HUNTER""]/choice[2]/text","Ignore the ship.","data/events_mantis.xml.append$/FTL/event[@name=""QUEST_HIVE_FREEMANTIS_HUNTER""]/choice[2]/text","","","",""
"src-en/data/events_mantis.xml.append:1362","data/events_mantis.xml.append$/FTL/event[@name=""QUEST_HIVE_FREEMANTIS_HUNTER""]/choice[2]/event/text","Though you doubt the ship poses a threat, you have no interest in communicating.","data/events_mantis.xml.append$/FTL/event[@name=""QUEST_HIVE_FREEMANTIS_HUNTER""]/choice[2]/event/text","","","",""
"src-en/data/events_mantis.xml.append:1364","data/events_mantis.xml.append$/FTL/event[@name=""QUEST_HIVE_FREEMANTIS_HUNTER""]/choice[2]/event/choice[1]/text","Do something onboard the ship.","data/events_mantis.xml.append$/FTL/event[@name=""QUEST_HIVE_FREEMANTIS_HUNTER""]/choice[2]/event/choice[1]/text","","","",""
"src-en/data/events_mantis.xml.append:1368","data/events_mantis.xml.append$/FTL/event[@name=""QUEST_HIVE_FREEMANTIS_HUNTER""]/choice[2]/event/choice[2]/text","Do nothing.","data/events_mantis.xml.append$/FTL/event[@name=""QUEST_HIVE_FREEMANTIS_HUNTER""]/choice[2]/event/choice[2]/text","","","",""
"src-en/data/events_mantis.xml.append:1375","data/events_mantis.xml.append$/FTL/event[@name=""QUEST_HIVE_FREEMANTIS_HUNTER_CAMP""]/text","A Mantis warcamp revealed to you by the Free Mantis is much smaller than expected. A single station surrounded by Mantis ships of different sizes orbits the beacon. They don't see you.","data/events_mantis.xml.append$/FTL/event[@name=""QUEST_HIVE_FREEMANTIS_HUNTER_CAMP""]/text","","","",""
"src-en/data/events_mantis.xml.append:1377","data/events_mantis.xml.append$/FTL/event[@name=""QUEST_HIVE_FREEMANTIS_HUNTER_CAMP""]/choice[1]/text","Attack the station, knowing it will anger the other, much larger ships.","data/events_mantis.xml.append$/FTL/event[@name=""QUEST_HIVE_FREEMANTIS_HUNTER_CAMP""]/choice[1]/text","","","",""
"src-en/data/events_mantis.xml.append:1379","data/events_mantis.xml.append$/FTL/event[@name=""QUEST_HIVE_FREEMANTIS_HUNTER_CAMP""]/choice[1]/event/text","You fly towards the station, attacking its main infrastructure. One of the largest ships detaches to defend the station.","data/events_mantis.xml.append$/FTL/event[@name=""QUEST_HIVE_FREEMANTIS_HUNTER_CAMP""]/choice[1]/event/text","","","",""
"src-en/data/events_mantis.xml.append:1383","data/events_mantis.xml.append$/FTL/event[@name=""QUEST_HIVE_FREEMANTIS_HUNTER_CAMP""]/choice[1]/event/choice/text","Continue...","data/events_mantis.xml.append$/FTL/event[@name=""QUEST_HIVE_FREEMANTIS_HUNTER_CAMP""]/choice[1]/event/choice/text","","","",""
"src-en/data/events_mantis.xml.append:1389","data/events_mantis.xml.append$/FTL/event[@name=""QUEST_HIVE_FREEMANTIS_HUNTER_CAMP""]/choice[2]/text","(Upg. Cloaking) Sabotage the station while hidden by your cloak.","data/events_mantis.xml.append$/FTL/event[@name=""QUEST_HIVE_FREEMANTIS_HUNTER_CAMP""]/choice[2]/text","","","",""
"src-en/data/events_mantis.xml.append:1393","data/events_mantis.xml.append$/FTL/event[@name=""QUEST_HIVE_FREEMANTIS_HUNTER_CAMP""]/choice[3]/text","(Adv. Cloaking) Sabotage the station while hidden by your cloak.","data/events_mantis.xml.append$/FTL/event[@name=""QUEST_HIVE_FREEMANTIS_HUNTER_CAMP""]/choice[3]/text","","","",""
"src-en/data/events_mantis.xml.append:1395","data/events_mantis.xml.append$/FTL/event[@name=""QUEST_HIVE_FREEMANTIS_HUNTER_CAMP""]/choice[3]/event/text","Hidden by your cloak, you successfully manage to deal massive damage to hull, compromising the station. The explosions send the docked Mantis ships flying away, leaving you alone with the wreck.","data/events_mantis.xml.append$/FTL/event[@name=""QUEST_HIVE_FREEMANTIS_HUNTER_CAMP""]/choice[3]/event/text","","","",""
"src-en/data/events_mantis.xml.append:1400","data/events_mantis.xml.append$/FTL/event[@name=""QUEST_HIVE_FREEMANTIS_HUNTER_CAMP""]/choice[4]/text","Leave.","data/events_mantis.xml.append$/FTL/event[@name=""QUEST_HIVE_FREEMANTIS_HUNTER_CAMP""]/choice[4]/text","","","",""
"src-en/data/events_mantis.xml.append:1402","data/events_mantis.xml.append$/FTL/event[@name=""QUEST_HIVE_FREEMANTIS_HUNTER_CAMP""]/choice[4]/event/text","You would have to be suicidal to attack any sort of Mantis camp, regardless of size. You fly away until you're certain you're out of their sight.","data/events_mantis.xml.append$/FTL/event[@name=""QUEST_HIVE_FREEMANTIS_HUNTER_CAMP""]/choice[4]/event/text","","","",""
"src-en/data/events_mantis.xml.append:1404","data/events_mantis.xml.append$/FTL/event[@name=""QUEST_HIVE_FREEMANTIS_HUNTER_CAMP""]/choice[4]/event/choice[1]/text","Do something onboard the ship.","data/events_mantis.xml.append$/FTL/event[@name=""QUEST_HIVE_FREEMANTIS_HUNTER_CAMP""]/choice[4]/event/choice[1]/text","","","",""
"src-en/data/events_mantis.xml.append:1408","data/events_mantis.xml.append$/FTL/event[@name=""QUEST_HIVE_FREEMANTIS_HUNTER_CAMP""]/choice[4]/event/choice[2]/text","Do nothing.","data/events_mantis.xml.append$/FTL/event[@name=""QUEST_HIVE_FREEMANTIS_HUNTER_CAMP""]/choice[4]/event/choice[2]/text","","","",""
"src-en/data/events_mantis.xml.append:1416","data/events_mantis.xml.append$/FTL/eventList[@name=""QUEST_HIVE_FREEMANTIS_HUNTER_CAMP_CLOAK""]/event[1]/text","Hidden by your cloak, you successfully manage to deal massive damage to its hull, compromising the station. The explosions send the docked Mantis ships flying away, leaving you alone with the wreck.","data/events_mantis.xml.append$/FTL/eventList[@name=""QUEST_HIVE_FREEMANTIS_HUNTER_CAMP_CLOAK""]/event[1]/text","","","",""
"src-en/data/events_mantis.xml.append:1420","data/events_mantis.xml.append$/FTL/eventList[@name=""QUEST_HIVE_FREEMANTIS_HUNTER_CAMP_CLOAK""]/event[2]/text","You attempt to destroy the station, but your cloak gives out before you can successfully demolish the hull. The attack sends most of the docked ships flying away, but the station itself is still standing and not about to surrender itself to you.","data/events_mantis.xml.append$/FTL/eventList[@name=""QUEST_HIVE_FREEMANTIS_HUNTER_CAMP_CLOAK""]/event[2]/text","","","",""
"src-en/data/events_mantis.xml.append:1423","data/events_mantis.xml.append$/FTL/eventList[@name=""QUEST_HIVE_FREEMANTIS_HUNTER_CAMP_CLOAK""]/event[2]/choice/text","Continue...","data/events_mantis.xml.append$/FTL/eventList[@name=""QUEST_HIVE_FREEMANTIS_HUNTER_CAMP_CLOAK""]/event[2]/choice/text","","","",""
"src-en/data/events_mantis.xml.append:1430","data/events_mantis.xml.append$/FTL/event[@name=""QUEST_HIVE_FREEMANTIS_HUNTER_CAMP_WIN""]/text","In a rare display of cowardice the remaining Mantis ships make no attempt to fight you and flee. You scrap the hull of the ship you just defeated before moving onto the station.","data/events_mantis.xml.append$/FTL/event[@name=""QUEST_HIVE_FREEMANTIS_HUNTER_CAMP_WIN""]/text","","","",""
"src-en/data/events_mantis.xml.append:1433","data/events_mantis.xml.append$/FTL/event[@name=""QUEST_HIVE_FREEMANTIS_HUNTER_CAMP_WIN""]/choice/text","Force the station to surrender.","data/events_mantis.xml.append$/FTL/event[@name=""QUEST_HIVE_FREEMANTIS_HUNTER_CAMP_WIN""]/choice/text","","","",""
"src-en/data/events_mantis.xml.append:1435","data/events_mantis.xml.append$/FTL/event[@name=""QUEST_HIVE_FREEMANTIS_HUNTER_CAMP_WIN""]/choice/event/text","With no ships left to defend it, the station gives into your demands and hands over more scrap.","data/events_mantis.xml.append$/FTL/event[@name=""QUEST_HIVE_FREEMANTIS_HUNTER_CAMP_WIN""]/choice/event/text","","","",""
"src-en/data/events_mantis.xml.append:1638","data/events_mantis.xml.append$/FTL/event[@name=""HIVE_MERCENARY""]/text","You can't help but shake the feeling you're being followed through this system. After some time spent running basic scans on the surroundings, it becomes clear your suspicions weren't unfounded. A Bishop vessel reveals itself, though its weapons are offline.","data/events_mantis.xml.append$/FTL/event[@name=""HIVE_MERCENARY""]/text","","","",""
"src-en/data/events_mantis.xml.append:1641","data/events_mantis.xml.append$/FTL/event[@name=""HIVE_MERCENARY""]/choice[1]/text","Wait to hear their message.","data/events_mantis.xml.append$/FTL/event[@name=""HIVE_MERCENARY""]/choice[1]/text","","","",""
"src-en/data/events_mantis.xml.append:1643","data/events_mantis.xml.append$/FTL/event[@name=""HIVE_MERCENARY""]/choice[1]/event/text","A female Bishop appears on the screen, out of breath as if she had been running despite being on a spaceship. ""You are Federation Multiverse Vessel, correct? Please disregard informalities and past inconveniences, for her royal majesty Queen Leikonpliiinakra has request for you. We cannot offer you Hive's allegiance or promises of safe travels, but you shall be given esteemed honor of queen's thanks! And if you so insist, perhaps ample cash reward.""","data/events_mantis.xml.append$/FTL/event[@name=""HIVE_MERCENARY""]/choice[1]/event/text","","","",""
"src-en/data/events_mantis.xml.append:1645","data/events_mantis.xml.append$/FTL/event[@name=""HIVE_MERCENARY""]/choice[1]/event/choice[1]/text","Listen to the offer.","data/events_mantis.xml.append$/FTL/event[@name=""HIVE_MERCENARY""]/choice[1]/event/choice[1]/text","","","",""
"src-en/data/events_mantis.xml.append:1647","data/events_mantis.xml.append$/FTL/event[@name=""HIVE_MERCENARY""]/choice[1]/event/choice[1]/event/text","""In this territory there is hatchery for future Suzerains and Bishops. However, dangerous rogue defectors have taken hold of the Hatchery. By order of the queen the eggs must be secured and moved to a new location. I will transfer the coordinates of Hatchery to you now. I hope to see you there.""","data/events_mantis.xml.append$/FTL/event[@name=""HIVE_MERCENARY""]/choice[1]/event/choice[1]/event/text","","","",""
"src-en/data/events_mantis.xml.append:1652","data/events_mantis.xml.append$/FTL/event[@name=""HIVE_MERCENARY""]/choice[1]/event/choice[2]/text","Refuse.","data/events_mantis.xml.append$/FTL/event[@name=""HIVE_MERCENARY""]/choice[1]/event/choice[2]/text","","","",""
"src-en/data/events_mantis.xml.append:1654","data/events_mantis.xml.append$/FTL/event[@name=""HIVE_MERCENARY""]/choice[1]/event/choice[2]/event/text","""Disappointing stance, but I haven't time to protest. If you will not assist then it would be my recommendation you leave Hive quickly before Leikonpliiinakra's forces discover you.""","data/events_mantis.xml.append$/FTL/event[@name=""HIVE_MERCENARY""]/choice[1]/event/choice[2]/event/text","","","",""
"src-en/data/events_mantis.xml.append:1656","data/events_mantis.xml.append$/FTL/event[@name=""HIVE_MERCENARY""]/choice[1]/event/choice[2]/event/choice/text","Continue...","data/events_mantis.xml.append$/FTL/event[@name=""HIVE_MERCENARY""]/choice[1]/event/choice[2]/event/choice/text","","","",""
"src-en/data/events_mantis.xml.append:1666","data/events_mantis.xml.append$/FTL/event[@name=""HIVE_MERCENARY""]/choice[2]/text","Risk nothing and attack immediately.","data/events_mantis.xml.append$/FTL/event[@name=""HIVE_MERCENARY""]/choice[2]/text","","","",""
"src-en/data/events_mantis.xml.append:1668","data/events_mantis.xml.append$/FTL/event[@name=""HIVE_MERCENARY""]/choice[2]/event/text","You're no man of patience, and even though this was likely something important, you've forgone that possibility entirely by making the first strike!","data/events_mantis.xml.append$/FTL/event[@name=""HIVE_MERCENARY""]/choice[2]/event/text","","","",""
"src-en/data/events_mantis.xml.append:1671","data/events_mantis.xml.append$/FTL/event[@name=""HIVE_MERCENARY""]/choice[2]/event/choice/text","Continue...","data/events_mantis.xml.append$/FTL/event[@name=""HIVE_MERCENARY""]/choice[2]/event/choice/text","","","",""
"src-en/data/events_mantis.xml.append:1695","data/events_mantis.xml.append$/FTL/event[@name=""HIVE_MERCENARY_HATCHERY""]/beaconType/unvisitedTooltip","Location of the Mantis hatchery.","data/events_mantis.xml.append$/FTL/event[@name=""HIVE_MERCENARY_HATCHERY""]/beaconType/unvisitedTooltip","","","",""
"src-en/data/events_mantis.xml.append:1696","data/events_mantis.xml.append$/FTL/event[@name=""HIVE_MERCENARY_HATCHERY""]/beaconType/visitedTooltip","Explored location. Nothing left of interest.","data/events_mantis.xml.append$/FTL/event[@name=""HIVE_MERCENARY_HATCHERY""]/beaconType/visitedTooltip","","","",""
"src-en/data/events_mantis.xml.append:1699","data/events_mantis.xml.append$/FTL/event[@name=""HIVE_MERCENARY_HATCHERY""]/text","You've arrived at the Hatchery, but you don't see any sign of the other Bishop ship. There is, however, a massive Suzerain cruiser here. You aren't sure how to proceed.","data/events_mantis.xml.append$/FTL/event[@name=""HIVE_MERCENARY_HATCHERY""]/text","","","",""
"src-en/data/events_mantis.xml.append:1702","data/events_mantis.xml.append$/FTL/event[@name=""HIVE_MERCENARY_HATCHERY""]/choice[1]/text","Attack the Hatchery yourself.","data/events_mantis.xml.append$/FTL/event[@name=""HIVE_MERCENARY_HATCHERY""]/choice[1]/text","","","",""
"src-en/data/events_mantis.xml.append:1704","data/events_mantis.xml.append$/FTL/event[@name=""HIVE_MERCENARY_HATCHERY""]/choice[1]/event/text","The cruiser seems to have several Suzerains led by a Bishop. That messenger wasn't lying, this Hatchery must be important to deserve this much security. Time for a colossal fight!","data/events_mantis.xml.append$/FTL/event[@name=""HIVE_MERCENARY_HATCHERY""]/choice[1]/event/text","","","",""
"src-en/data/events_mantis.xml.append:1707","data/events_mantis.xml.append$/FTL/event[@name=""HIVE_MERCENARY_HATCHERY""]/choice[1]/event/choice/text","Continue...","data/events_mantis.xml.append$/FTL/event[@name=""HIVE_MERCENARY_HATCHERY""]/choice[1]/event/choice/text","","","",""
"src-en/data/events_mantis.xml.append:1713","data/events_mantis.xml.append$/FTL/event[@name=""HIVE_MERCENARY_HATCHERY""]/choice[2]/text","Avoid the Hatchery.","data/events_mantis.xml.append$/FTL/event[@name=""HIVE_MERCENARY_HATCHERY""]/choice[2]/text","","","",""
"src-en/data/events_mantis.xml.append:1715","data/events_mantis.xml.append$/FTL/event[@name=""HIVE_MERCENARY_HATCHERY""]/choice[2]/event/text","Without the other Bishop, you can't be certain what the plan is. It's better not to take the risk and leave while you're still alive.","data/events_mantis.xml.append$/FTL/event[@name=""HIVE_MERCENARY_HATCHERY""]/choice[2]/event/text","","","",""
"src-en/data/events_mantis.xml.append:1717","data/events_mantis.xml.append$/FTL/event[@name=""HIVE_MERCENARY_HATCHERY""]/choice[2]/event/choice[1]/text","Do something onboard the ship.","data/events_mantis.xml.append$/FTL/event[@name=""HIVE_MERCENARY_HATCHERY""]/choice[2]/event/choice[1]/text","","","",""
"src-en/data/events_mantis.xml.append:1721","data/events_mantis.xml.append$/FTL/event[@name=""HIVE_MERCENARY_HATCHERY""]/choice[2]/event/choice[2]/text","Do nothing.","data/events_mantis.xml.append$/FTL/event[@name=""HIVE_MERCENARY_HATCHERY""]/choice[2]/event/choice[2]/text","","","",""
"src-en/data/events_mantis.xml.append:1728","data/events_mantis.xml.append$/FTL/event[@name=""HIVE_MERCENARY_HATCHERY_TIMER""]/text","You happen to notice, that while you've been fighting, the other Bishop ship has arrived. However, instead of coming to assist you, it has instead landed next to the Hatchery and begun to load its cargo with the eggs. It seems they have no intentions of sticking around, so if you want to confront them you'll have to kill this cruiser quickly!","data/events_mantis.xml.append$/FTL/event[@name=""HIVE_MERCENARY_HATCHERY_TIMER""]/text","","","",""
"src-en/data/events_mantis.xml.append:1733","data/events_mantis.xml.append$/FTL/event[@name=""HIVE_MERCENARY_HATCHERY_TIMER""]/triggeredEvent/triggeredEventBox/tooltip","If you can't kill the Suzerain Cruiser before the time runs out, the Bishop will escape with the eggs.","data/events_mantis.xml.append$/FTL/event[@name=""HIVE_MERCENARY_HATCHERY_TIMER""]/triggeredEvent/triggeredEventBox/tooltip","","","",""
"src-en/data/events_mantis.xml.append:1739","data/events_mantis.xml.append$/FTL/event[@name=""HIVE_MERCENARY_HATCHERY_FAIL""]/text","It seems you weren't fast enough - and now the Bishop has jumped away with the eggs! The Suzerain cruiser has noticed as well, because it immediately switches focus from you onto the trajectory of the fleeing Bishop and jumps away after it! Seems this was all just one giant ruse...","data/events_mantis.xml.append$/FTL/event[@name=""HIVE_MERCENARY_HATCHERY_FAIL""]/text","","","",""
"src-en/data/events_mantis.xml.append:1743","data/events_mantis.xml.append$/FTL/event[@name=""HIVE_MERCENARY_HATCHERY_WIN""]/text","The Suzerain cruiser has been defeated. The immense hull of the ship comes crashing down onto the planet's surface, though fortunately it lands in the nearby river rather than on the Hatchery itself. Below Mantis workers and Engi slaves flee, but the Bishop ship has not yet finished loading their cargo.","data/events_mantis.xml.append$/FTL/event[@name=""HIVE_MERCENARY_HATCHERY_WIN""]/text","","","",""
"src-en/data/events_mantis.xml.append:1747","data/events_mantis.xml.append$/FTL/event[@name=""HIVE_MERCENARY_HATCHERY_WIN""]/choice/text","Confront the Bishop.","data/events_mantis.xml.append$/FTL/event[@name=""HIVE_MERCENARY_HATCHERY_WIN""]/choice/text","","","",""
"src-en/data/events_mantis.xml.append:1749","data/events_mantis.xml.append$/FTL/event[@name=""HIVE_MERCENARY_HATCHERY_WIN""]/choice/event/text","""You are surviving? Impossible, but impressive! You fight as well as my father!""","data/events_mantis.xml.append$/FTL/event[@name=""HIVE_MERCENARY_HATCHERY_WIN""]/choice/event/text","","","",""
"src-en/data/events_mantis.xml.append:1751","data/events_mantis.xml.append$/FTL/event[@name=""HIVE_MERCENARY_HATCHERY_WIN""]/choice/event/choice/text","Why did you use us as distraction? What's going on?","data/events_mantis.xml.append$/FTL/event[@name=""HIVE_MERCENARY_HATCHERY_WIN""]/choice/event/choice/text","","","",""
"src-en/data/events_mantis.xml.append:1753","data/events_mantis.xml.append$/FTL/event[@name=""HIVE_MERCENARY_HATCHERY_WIN""]/choice/event/choice/event/text","""I did not plan for confrontation like this, but it is time I confess. I am Laiiikarkapi, the first female Bishop appointed since the founding of the Episcopacy under queen Riiipiokinith. It would seem I have failed her majesty Leikonpliiinakra, but it is greater service to Mantis-kind that I prevent these eggs from life of warriors than serve my purpose and raise them same as I was.""","data/events_mantis.xml.append$/FTL/event[@name=""HIVE_MERCENARY_HATCHERY_WIN""]/choice/event/choice/event/text","","","",""
"src-en/data/events_mantis.xml.append:1755","data/events_mantis.xml.append$/FTL/event[@name=""HIVE_MERCENARY_HATCHERY_WIN""]/choice/event/choice/event/choice/text","Where will you take the eggs then?","data/events_mantis.xml.append$/FTL/event[@name=""HIVE_MERCENARY_HATCHERY_WIN""]/choice/event/choice/event/choice/text","","","",""
"src-en/data/events_mantis.xml.append:1757","data/events_mantis.xml.append$/FTL/event[@name=""HIVE_MERCENARY_HATCHERY_WIN""]/choice/event/choice/event/choice/event/text","""I have arranged plans. Free Mantis colony, away from Hive, has agreed to take and raise them as their own. I have faith this will be a better home. I do not know what will happen to me after. It seems fate has it my death as traitor to Hive is certain. But a noble death it will be. That is not of worry to you. Be it may that I trick you, you have helped me greatly. I will show you how gain access to blueprints of cruiser you have defeated today, so that your Federation might take advantage of its power.""","data/events_mantis.xml.append$/FTL/event[@name=""HIVE_MERCENARY_HATCHERY_WIN""]/choice/event/choice/event/choice/event/text","","","",""
"src-en/data/events_mantis.xml.append:1760","data/events_mantis.xml.append$/FTL/event[@name=""HIVE_MERCENARY_HATCHERY_WIN""]/choice/event/choice/event/choice/event/choice[1]/text","Offer to take her with you.","data/events_mantis.xml.append$/FTL/event[@name=""HIVE_MERCENARY_HATCHERY_WIN""]/choice/event/choice/event/choice/event/choice[1]/text","","","",""
"src-en/data/events_mantis.xml.append:1762","data/events_mantis.xml.append$/FTL/event[@name=""HIVE_MERCENARY_HATCHERY_WIN""]/choice/event/choice/event/choice/event/choice[1]/event/text","""Huh? You are serious? I would not normally consider, but... saving reality could mean pardon, and life in Federation better than death in Hive. Perhaps my legacy does not end here then. I will have my crew transport eggs on their own. They are capable. I shall be with you momentarily, captain.""","data/events_mantis.xml.append$/FTL/event[@name=""HIVE_MERCENARY_HATCHERY_WIN""]/choice/event/choice/event/choice/event/choice[1]/event/text","","","",""
"src-en/data/events_mantis.xml.append:1768","data/events_mantis.xml.append$/FTL/event[@name=""HIVE_MERCENARY_HATCHERY_WIN""]/choice/event/choice/event/choice/event/choice[2]/text","Wish her the best of luck and carry on.","data/events_mantis.xml.append$/FTL/event[@name=""HIVE_MERCENARY_HATCHERY_WIN""]/choice/event/choice/event/choice/event/choice[2]/text","","","",""
"src-en/data/events_mantis.xml.append:1770","data/events_mantis.xml.append$/FTL/event[@name=""HIVE_MERCENARY_HATCHERY_WIN""]/choice/event/choice/event/choice/event/choice[2]/event/text","""Yes, may you having the best of luck as well. Perhaps you will hear news of my fate in Federation some time soon...""","data/events_mantis.xml.append$/FTL/event[@name=""HIVE_MERCENARY_HATCHERY_WIN""]/choice/event/choice/event/choice/event/choice[2]/event/text","","","",""
"src-en/data/events_mantis.xml.append:1774","data/events_mantis.xml.append$/FTL/event[@name=""HIVE_MERCENARY_HATCHERY_WIN""]/choice/event/choice/event/choice/event/choice[3]/text","Request her help in finding the queen.","data/events_mantis.xml.append$/FTL/event[@name=""HIVE_MERCENARY_HATCHERY_WIN""]/choice/event/choice/event/choice/event/choice[3]/text","","","",""
"src-en/data/events_mantis.xml.append:1776","data/events_mantis.xml.append$/FTL/event[@name=""HIVE_MERCENARY_HATCHERY_WIN""]/choice/event/choice/event/choice/event/choice[3]/event/text","""Huh? You are serious? I do not know what you are hoping to achieve, but it is certainly better than a certain death at hands of the Episcopacy. I will have my crew transport eggs on their own. They are capable. I shall be with you momentarily, captain.""","data/events_mantis.xml.append$/FTL/event[@name=""HIVE_MERCENARY_HATCHERY_WIN""]/choice/event/choice/event/choice/event/choice[3]/event/text","","","",""
"src-en/data/events_mantis.xml.append:1779","data/events_mantis.xml.append$/FTL/event[@name=""HIVE_MERCENARY_HATCHERY_WIN""]/choice/event/choice/event/choice/event/choice[3]/event/choice/text","Continue...","data/events_mantis.xml.append$/FTL/event[@name=""HIVE_MERCENARY_HATCHERY_WIN""]/choice/event/choice/event/choice/event/choice[3]/event/choice/text","","","",""
"src-en/data/events_mantis.xml.append:1781","data/events_mantis.xml.append$/FTL/event[@name=""HIVE_MERCENARY_HATCHERY_WIN""]/choice/event/choice/event/choice/event/choice[3]/event/choice/event/text","With Laiiikarkapi's directions and Kaz's plans, you should now be able to track down the Mantis Queen herself. This won't be easy, but who knows what you might able to accomplish if you pull this off. Make sure you keep Laiiikarkapi and Kazaaak around, as without them, you won't be able to find your way.","data/events_mantis.xml.append$/FTL/event[@name=""HIVE_MERCENARY_HATCHERY_WIN""]/choice/event/choice/event/choice/event/choice[3]/event/choice/event/text","","","",""
"src-en/data/events_mantis.xml.append:1807","data/events_mantis.xml.append$/FTL/event[@name=""HIVE""]/beaconType/unvisitedTooltip","Location of the Mantis Hive.","data/events_mantis.xml.append$/FTL/event[@name=""HIVE""]/beaconType/unvisitedTooltip","","","",""
"src-en/data/events_mantis.xml.append:1808","data/events_mantis.xml.append$/FTL/event[@name=""HIVE""]/beaconType/visitedTooltip","Explored location. Nothing left of interest.","data/events_mantis.xml.append$/FTL/event[@name=""HIVE""]/beaconType/visitedTooltip","","","",""
"src-en/data/events_mantis.xml.append:1810","data/events_mantis.xml.append$/FTL/event[@name=""HIVE""]/text","This is it- the Mantis Hive. No wonder it's so hard to find, as the bulk of the city is located in a massive cavern underground. Thermal power plants are scattered around massive pits of magma and a large city stands in the center. Even from such a distance, you can see the royal palace...","data/events_mantis.xml.append$/FTL/event[@name=""HIVE""]/text","","","",""
"src-en/data/events_mantis.xml.append:1813","data/events_mantis.xml.append$/FTL/event[@name=""HIVE""]/choice[1]/text","We have both Kaz and Lai, we can do this.","data/events_mantis.xml.append$/FTL/event[@name=""HIVE""]/choice[1]/text","","","",""
